{
  "$schema": "https://json-schema.org/draft/2020-12/schema",
  "$id": "https://github.com/MarcoPorcellato/Latent-TRIZ/schemas/a0x-hosted-gate-a-verifier-policy.schema.json",
  "type": "object",
  "additionalProperties": false,
  "required": ["profile", "repository", "signer_workflow", "predicate_type", "cert_oidc_issuer", "required_event", "required_ref", "deny_self_hosted_runners", "require_verified_timestamp"],
  "properties": {
    "profile": {"const": "a0x-hosted-gate-a-verifier-v1"},
    "repository": {"const": "MarcoPorcellato/Latent-TRIZ"},
    "signer_workflow": {"const": "MarcoPorcellato/Latent-TRIZ/.github/workflows/a0x-hosted-gate-a.yml"},
    "predicate_type": {"const": "https://slsa.dev/provenance/v1"},
    "cert_oidc_issuer": {"const": "https://token.actions.githubusercontent.com"},
    "required_event": {"const": "push"},
    "required_ref": {"const": "refs/heads/main"},
    "deny_self_hosted_runners": {"type": "boolean", "const": true},
    "require_verified_timestamp": {"type": "boolean", "const": true}
  }
}
