{"cert_oidc_issuer":"https://token.actions.githubusercontent.com","deny_self_hosted_runners":true,"predicate_type":"https://slsa.dev/provenance/v1","profile":"a0x-hosted-gate-a-verifier-v1","repository":"MarcoPorcellato/Latent-TRIZ","require_verified_timestamp":true,"required_event":"push","required_ref":"refs/heads/main","signer_workflow":"MarcoPorcellato/Latent-TRIZ/.github/workflows/a0x-hosted-gate-a.yml"}
